{
  "estimate_changes": [
    {
      "change_points": null,
      "estimate_id": "est-official-P_DOOM-1y",
      "new_display": "Insufficiently calibrated",
      "new_p50": null,
      "previous_display": "",
      "previous_p50": null,
      "status": "insufficiently_calibrated"
    },
    {
      "change_points": null,
      "estimate_id": "est-official-P_DOOM-3y",
      "new_display": "Insufficiently calibrated",
      "new_p50": null,
      "previous_display": "",
      "previous_p50": null,
      "status": "insufficiently_calibrated"
    },
    {
      "change_points": null,
      "estimate_id": "est-official-P_DOOM-5y",
      "new_display": "Insufficiently calibrated",
      "new_p50": null,
      "previous_display": "",
      "previous_p50": null,
      "status": "insufficiently_calibrated"
    },
    {
      "change_points": null,
      "estimate_id": "est-official-P_DOOM-10y",
      "new_display": "Insufficiently calibrated",
      "new_p50": null,
      "previous_display": "",
      "previous_p50": null,
      "status": "insufficiently_calibrated"
    },
    {
      "change_points": null,
      "estimate_id": "est-official-P_DOOM-25y",
      "new_display": "Insufficiently calibrated",
      "new_p50": null,
      "previous_display": "",
      "previous_p50": null,
      "status": "insufficiently_calibrated"
    },
    {
      "change_points": null,
      "estimate_id": "est-official-P_DOOM-2100",
      "new_display": "Insufficiently calibrated",
      "new_p50": null,
      "previous_display": "",
      "previous_p50": null,
      "status": "insufficiently_calibrated"
    },
    {
      "change_points": null,
      "estimate_id": "est-official-P_DOOM-eventual",
      "new_display": "Insufficiently calibrated",
      "new_p50": null,
      "previous_display": "",
      "previous_p50": null,
      "status": "insufficiently_calibrated"
    },
    {
      "change_points": null,
      "estimate_id": "est-external-G-FIX-EXT-2100",
      "new_display": "4%",
      "new_p50": 0.04,
      "previous_display": "",
      "previous_p50": null,
      "status": "external_aggregate"
    },
    {
      "change_points": null,
      "estimate_id": "est-research-P_DOOM-5y",
      "new_display": "1%",
      "new_p50": 0.005028,
      "previous_display": "",
      "previous_p50": null,
      "status": "research_mode"
    },
    {
      "change_points": null,
      "estimate_id": "est-research-O3-5y",
      "new_display": "<1%",
      "new_p50": 0.001825,
      "previous_display": "",
      "previous_p50": null,
      "status": "research_mode"
    },
    {
      "change_points": null,
      "estimate_id": "est-research-P_COLLAPSE-5y",
      "new_display": "<1%",
      "new_p50": 0.001559,
      "previous_display": "",
      "previous_p50": null,
      "status": "research_mode"
    },
    {
      "change_points": null,
      "estimate_id": "est-research-O6-5y",
      "new_display": "<1%",
      "new_p50": 0.00045,
      "previous_display": "",
      "previous_p50": null,
      "status": "research_mode"
    },
    {
      "change_points": null,
      "estimate_id": "est-research-O7-5y",
      "new_display": "<1%",
      "new_p50": 0.000185,
      "previous_display": "",
      "previous_p50": null,
      "status": "research_mode"
    },
    {
      "change_points": null,
      "estimate_id": "est-research-P_DOOM-10y",
      "new_display": "1%",
      "new_p50": 0.008291,
      "previous_display": "",
      "previous_p50": null,
      "status": "research_mode"
    },
    {
      "change_points": null,
      "estimate_id": "est-research-O3-10y",
      "new_display": "<1%",
      "new_p50": 0.002985,
      "previous_display": "",
      "previous_p50": null,
      "status": "research_mode"
    },
    {
      "change_points": null,
      "estimate_id": "est-research-P_COLLAPSE-10y",
      "new_display": "<1%",
      "new_p50": 0.002526,
      "previous_display": "",
      "previous_p50": null,
      "status": "research_mode"
    },
    {
      "change_points": null,
      "estimate_id": "est-research-O6-10y",
      "new_display": "<1%",
      "new_p50": 0.000729,
      "previous_display": "",
      "previous_p50": null,
      "status": "research_mode"
    },
    {
      "change_points": null,
      "estimate_id": "est-research-O7-10y",
      "new_display": "<1%",
      "new_p50": 0.000304,
      "previous_display": "",
      "previous_p50": null,
      "status": "research_mode"
    },
    {
      "change_points": null,
      "estimate_id": "est-research-P_DOOM-25y",
      "new_display": "1%",
      "new_p50": 0.011594,
      "previous_display": "",
      "previous_p50": null,
      "status": "research_mode"
    },
    {
      "change_points": null,
      "estimate_id": "est-research-O3-25y",
      "new_display": "<1%",
      "new_p50": 0.004077,
      "previous_display": "",
      "previous_p50": null,
      "status": "research_mode"
    },
    {
      "change_points": null,
      "estimate_id": "est-research-P_COLLAPSE-25y",
      "new_display": "<1%",
      "new_p50": 0.003462,
      "previous_display": "",
      "previous_p50": null,
      "status": "research_mode"
    },
    {
      "change_points": null,
      "estimate_id": "est-research-O6-25y",
      "new_display": "<1%",
      "new_p50": 0.001012,
      "previous_display": "",
      "previous_p50": null,
      "status": "research_mode"
    },
    {
      "change_points": null,
      "estimate_id": "est-research-O7-25y",
      "new_display": "<1%",
      "new_p50": 0.000418,
      "previous_display": "",
      "previous_p50": null,
      "status": "research_mode"
    }
  ],
  "generated_at": "2026-09-26T12:00:00Z",
  "heightened_review_triggers": [
    "first_release",
    "single_laboratory_evidence"
  ],
  "index_changes": [
    {
      "delta": null,
      "index_id": "evidence_pressure",
      "new": 50,
      "previous": null
    },
    {
      "delta": null,
      "index_id": "capability_pressure",
      "new": 61.2,
      "previous": null
    },
    {
      "delta": null,
      "index_id": "control_strength",
      "new": 27.5,
      "previous": null
    },
    {
      "delta": null,
      "index_id": "incident_pressure",
      "new": 2.4538,
      "previous": null
    },
    {
      "delta": null,
      "index_id": "uncertainty",
      "new": 24.5069,
      "previous": null
    },
    {
      "delta": null,
      "index_id": "agentic_infrastructure_risk",
      "new": 61.55,
      "previous": null
    },
    {
      "delta": null,
      "index_id": "attention",
      "new": null,
      "previous": null
    }
  ],
  "kind": "delta_record",
  "model_version_changed": false,
  "new_forecast_source_ids": [],
  "new_scenario_ids": [],
  "notes": [
    "First release: no previous estimate to compare against."
  ],
  "previous_release_id": null,
  "previous_snapshot_id": null,
  "redefined_benchmark_ids": [],
  "release_id": null,
  "schema_version": 1,
  "snapshot_id": "snap-1999-01-01-001"
}
